{
  "schema_version": 1,
  "dataset_id": "lexical_progression_strands",
  "version": 1,
  "level_order": [
    "a1",
    "a2",
    "b1",
    "b2",
    "c1",
    "c2"
  ],
  "inputs": [
    {
      "path": "data/derived/oxford-3000-all.json",
      "sha256": "e80f964b0e49d66702c2837a8605e3ef7ab2019d7eebe03a836ef6e088a7e951"
    },
    {
      "path": "data/derived/oxford-5000-all.json",
      "sha256": "c15e161287ac141153bc2ce9956f27558273c64658ebe3ec1633016925a7ef61"
    },
    {
      "path": "data/reviewed/level-exit-profiles-v1.json",
      "sha256": "8cd53270688f6aafadddb7beb7f8f3717d832a464f127fefd3def3a1a62da30a"
    },
    {
      "path": "data/reviewed/communicative-function-strands-v1.json",
      "sha256": "84cef12823195ce803b9f4945406188ac8ad3c20eb0968c3f385dce0605153f2"
    }
  ],
  "reference_pool": {
    "use_policy": "reference_pool_not_automatic_target_inventory",
    "datasets": [
      {
        "dataset_id": "oxford_3000_all",
        "path": "data/derived/oxford-3000-all.json",
        "entry_line_count": 3307,
        "distinct_printed_headword_labels": 2998,
        "level_counts": {
          "a1": 900,
          "a2": 871,
          "b1": 809,
          "b2": 727
        },
        "record_ids_sha256": "e9f228811be0e95cd7a4d546ca03a76eb719166b8ab95b3260ce9db51305accc"
      },
      {
        "dataset_id": "oxford_5000_all",
        "path": "data/derived/oxford-5000-all.json",
        "entry_line_count": 2015,
        "distinct_printed_headword_labels": 1999,
        "level_counts": {
          "b2": 700,
          "c1": 1315
        },
        "record_ids_sha256": "152ae57701feb30a4438c4b5c9f7d47dd6da582a37a67cefbfb6df4ea0c0494e"
      }
    ],
    "total_entry_lines": 5322,
    "all_source_record_ids_sha256": "d41c6d9e918208afa32de581c647b7f9b20aeb7875b5fae47bad1a1e82fcbb5d",
    "levels_without_published_pool": [
      "c2"
    ],
    "all_records_accounted_for": true
  },
  "selection_contract": {
    "communicative_owner_dataset": "communicative_function_progression_strands",
    "communicative_owner_count": 41,
    "required_item_fields": [
      "lexical_item_id",
      "canonical_form",
      "item_type",
      "meaning_or_function",
      "communicative_owner_ids",
      "source_refs",
      "first_exposure_level",
      "first_guided_production_level",
      "consolidation_level",
      "recycle_locations",
      "receptive_expectation",
      "productive_expectation",
      "register",
      "collocations_or_frames",
      "arabic_learner_risks",
      "decision_rationale",
      "review"
    ],
    "principles": [
      "Start from an approved communicative outcome, never from an isolated word-list row.",
      "Select a specific meaning, grammatical use, chunk, or collocation; a headword is not one indivisible target.",
      "Prefer high-utility language that recurs across more than one approved task or domain.",
      "Keep receptive exposure and productive control as separate decisions.",
      "Require a planned fresh recycle after guided production and before consolidation.",
      "Record deliberate omissions so breadth can be audited without forcing every reference-pool entry into the course.",
      "Test register, cultural fit, adult relevance, and Arabic explanation needs before authoring.",
      "Count source entry lines as evidence coverage, never as promised learner word counts."
    ],
    "promotion_gates": {
      "expose_to_introduce": [
        "The meaning or function is needed by an approved outcome.",
        "The learner can notice it in comprehensible context without an independent-production demand."
      ],
      "introduce_to_practise": [
        "Meaning, form, pronunciation when spoken, and at least one usable frame are specified.",
        "The practice task requires the target meaning rather than allowing unrelated substitution."
      ],
      "practise_to_consolidate": [
        "The item has returned in at least one distinct context after introduction.",
        "Fresh performance requires retrieval without copying and meets the level control boundary."
      ],
      "consolidate_to_extend": [
        "The consolidated meaning remains retrievable.",
        "The new use adds sense, collocation, domain, register, nuance, or independence."
      ]
    }
  },
  "resource_strands": [
    {
      "strand_id": "lexis.core_headwords",
      "strand_code": "core_headwords",
      "title": "Core high-frequency headwords and meanings",
      "first_guided_productive_level": "a1",
      "first_family_consolidation_level": "a1",
      "stages": [
        {
          "level": "a1",
          "expectation": "Control a small outcome-bound set of concrete words and meanings for immediate personal situations.",
          "exit_boundary": "Basic words and phrases tied to particular concrete situations.",
          "profile_claim_id": "a1.language_control.vocabulary",
          "control_focus": "both",
          "lifecycle_states": [
            "introduce",
            "practise",
            "consolidate"
          ]
        },
        {
          "level": "a2",
          "expectation": "Extend the core to routine needs, transactions, local places, people, and everyday description.",
          "exit_boundary": "Sufficient for routine transactions, basic communicative needs, and simple survival situations.",
          "profile_claim_id": "a2.language_control.vocabulary",
          "control_focus": "both",
          "lifecycle_states": [
            "recycle",
            "extend"
          ]
        },
        {
          "level": "b1",
          "expectation": "Use a good general range for familiar life, travel, work, study, and personal interests.",
          "exit_boundary": "Good range for familiar topics and everyday life, with limitations on unfamiliar or complex ideas.",
          "profile_claim_id": "b1.language_control.vocabulary",
          "control_focus": "both",
          "lifecycle_states": [
            "recycle",
            "extend"
          ]
        },
        {
          "level": "b2",
          "expectation": "Select accurately from a broad general range and relevant field-related vocabulary.",
          "exit_boundary": "Good general and field-related range with systematic use of many appropriate collocations.",
          "profile_claim_id": "b2.language_control.vocabulary",
          "control_focus": "both",
          "lifecycle_states": [
            "recycle",
            "extend"
          ]
        },
        {
          "level": "c1",
          "expectation": "Use a broad repertoire flexibly with little obvious searching and effective alternatives.",
          "exit_boundary": "Broad lexical and idiomatic command with effective circumlocution and little obvious searching.",
          "profile_claim_id": "c1.language_control.vocabulary",
          "control_focus": "both",
          "lifecycle_states": [
            "recycle",
            "extend"
          ]
        },
        {
          "level": "c2",
          "expectation": "Choose precise lexical senses for subtle distinctions without treating rarity as proficiency.",
          "exit_boundary": "Very broad idiomatic and colloquial repertoire with awareness of connotation and fine meaning distinctions.",
          "profile_claim_id": "c2.language_control.vocabulary",
          "control_focus": "both",
          "lifecycle_states": [
            "recycle",
            "extend"
          ]
        }
      ],
      "review": {
        "status": "accepted",
        "basis": "approved_exit_boundary_plus_product_lexical_resource_review"
      }
    },
    {
      "strand_id": "lexis.formulaic_chunks",
      "strand_code": "formulaic_chunks",
      "title": "Formulaic chunks and interactional frames",
      "first_guided_productive_level": "a1",
      "first_family_consolidation_level": "a1",
      "stages": [
        {
          "level": "a1",
          "expectation": "Use short learnt chunks for greeting, identity, immediate needs, thanks, and basic repair.",
          "exit_boundary": "Basic words and phrases tied to particular concrete situations.",
          "profile_claim_id": "a1.language_control.vocabulary",
          "control_focus": "both",
          "lifecycle_states": [
            "introduce",
            "practise",
            "consolidate"
          ]
        },
        {
          "level": "a2",
          "expectation": "Combine routine chunks for transactions, invitations, requests, directions, and social contact.",
          "exit_boundary": "Sufficient for routine transactions, basic communicative needs, and simple survival situations.",
          "profile_claim_id": "a2.language_control.vocabulary",
          "control_focus": "both",
          "lifecycle_states": [
            "recycle",
            "extend"
          ]
        },
        {
          "level": "b1",
          "expectation": "Adapt semi-fixed frames to keep familiar exchanges and connected accounts moving.",
          "exit_boundary": "Good range for familiar topics and everyday life, with limitations on unfamiliar or complex ideas.",
          "profile_claim_id": "b1.language_control.vocabulary",
          "control_focus": "both",
          "lifecycle_states": [
            "recycle",
            "extend"
          ]
        },
        {
          "level": "b2",
          "expectation": "Use a varied phraseological repertoire to frame viewpoints, turns, comparison, and repair.",
          "exit_boundary": "Good general and field-related range with systematic use of many appropriate collocations.",
          "profile_claim_id": "b2.language_control.vocabulary",
          "control_focus": "both",
          "lifecycle_states": [
            "recycle",
            "extend"
          ]
        },
        {
          "level": "c1",
          "expectation": "Select flexible discourse and interpersonal bundles across social, academic, and professional contexts.",